Link,GName,Structure,Description
https://go.drugbank.com/drugs/DB01174,Phenobarbital,https://go.drugbank.com/structures/DB01174/image.svg,"A long-lasting barbiturate and anticonvulsant used in the treatment of all types of seizures, except for absent seizures."
https://go.drugbank.com/drugs/DB03255,Phenol,https://go.drugbank.com/structures/DB03255/image.svg,An antiseptic and disinfectant used in a variety of settings.
https://go.drugbank.com/drugs/DB04824,Phenolphthalein,https://go.drugbank.com/structures/DB04824/image.svg,A drug used for symptomatic relief of constipation and bowel cleansing prior to medical procedures.
https://go.drugbank.com/drugs/DB00925,Phenoxybenzamine,https://go.drugbank.com/structures/DB00925/image.svg,An alpha adrenergic antagonist used to treat pheochromocytoma and episodes of hypertension and sweating.
https://go.drugbank.com/drugs/DB11304,Phenoxyethanol,https://go.drugbank.com/structures/DB11304/image.svg,An antiseptic used as a hand disinfectant or preservative in medications.
https://go.drugbank.com/drugs/DB00417,Phenoxymethylpenicillin,https://go.drugbank.com/structures/DB00417/image.svg,"A penicillin antibiotic used to prevent and treat mild to moderately severe infections in the respiratory tract, skin, and soft tissues."
https://go.drugbank.com/drugs/DB00946,Phenprocoumon,https://go.drugbank.com/structures/DB00946/image.svg,An anticoagulant drug used for the prevention of thrombosis.
https://go.drugbank.com/drugs/DB00832,Phensuximide,https://go.drugbank.com/structures/DB00832/image.svg,For the treatment of epilepsy.
https://go.drugbank.com/drugs/DB00191,Phentermine,https://go.drugbank.com/structures/DB00191/image.svg,A sympathomimetic anorectic agent used as a short-term adjunct therapy that is included in a regimen of weight reduction in cases of exogenous obesity.
https://go.drugbank.com/drugs/DB00692,Phentolamine,https://go.drugbank.com/structures/DB00692/image.svg,"An alpha-adrenergic blocker used to treat hypertensive episodes, diagnose pheochromocytoma, treat norepinephrine administration site reactions, and reverse soft tissue anesthesia and mydriasis."
https://go.drugbank.com/drugs/DB06807,Phenyl aminosalicylate,https://go.drugbank.com/structures/DB06807/image.svg,Not Annotated
https://go.drugbank.com/drugs/DB11071,Phenyl salicylate,https://go.drugbank.com/structures/DB11071/image.svg,Pain and fever .
https://go.drugbank.com/drugs/DB09269,Phenylacetic acid,https://go.drugbank.com/structures/DB09269/image.svg,An agent used as an adjunct to treat acute hyperammonemia and associated encephalopathy in adult and pediatric patients with deficiencies in enzymes of the urea cycle.
https://go.drugbank.com/drugs/DB00120,Phenylalanine,https://go.drugbank.com/structures/DB00120/image.svg,An amino acid commonly found as a component of total parenteral nutrition.
https://go.drugbank.com/drugs/DB00812,Phenylbutazone,https://go.drugbank.com/structures/DB00812/image.svg,An NSAID used to treat backache and ankylosing spondylitis.
https://go.drugbank.com/drugs/DB06819,Phenylbutyric acid,https://go.drugbank.com/structures/DB06819/image.svg,"An agent indicated for the adjunctive therapy for the management of chronic urea cycle disorders due to deficiencies in specific enzymes, including the neonatal-onset deficiency and late-onset disease with a history of hyperammonemic encephalopathy."
https://go.drugbank.com/drugs/DB00388,Phenylephrine,https://go.drugbank.com/structures/DB00388/image.svg,"An alpha-1 adrenergic agonist used in the management of hypotension, generally in the surgical setting associated with the use of anesthetics."
https://go.drugbank.com/drugs/DB14120,Phenylethyl resorcinol,https://go.drugbank.com/structures/DB14120/image.svg,A tyrosinase inhibitor with skin-lightening activity.
https://go.drugbank.com/drugs/DB00397,Phenylpropanolamine,https://go.drugbank.com/structures/DB00397/image.svg,"A sympathomimetic that was previously used in nasal decongestants and weight loss products, but has been withdrawn by the FDA due to safety risks and lack of efficacy."
https://go.drugbank.com/drugs/DB11160,Phenyltoloxamine,https://go.drugbank.com/structures/DB11160/image.svg,A medication used to treat minor aches and pains.
https://go.drugbank.com/drugs/DB00252,Phenytoin,https://go.drugbank.com/structures/DB00252/image.svg,An anticonvulsant drug used in the prophylaxis and control of various types of seizures.
https://go.drugbank.com/drugs/DB13911,Phloxine B,https://go.drugbank.com/structures/DB13911/image.svg,"For use in dental disclosing products, allowing for highlighting of bacterial placques."
https://go.drugbank.com/drugs/DB09209,Pholcodine,https://go.drugbank.com/structures/DB09209/image.svg,An opioid antitussive used to suppress unproductive coughing.
https://go.drugbank.com/drugs/DB09394,Phosphoric acid,https://go.drugbank.com/structures/DB09394/image.svg,"An ingredient used for electrolyte replenishment and total parenteral nutrition (TPN) therapy, and for the relief of upset stomach associated with nausea."
https://go.drugbank.com/drugs/DB14151,Phosphorus,https://go.drugbank.com/structures/DB14151/image.svg,A medication indicated in the treatment of hypophosphatemia.
https://go.drugbank.com/drugs/DB13248,Phthalylsulfathiazole,https://go.drugbank.com/structures/DB13248/image.svg,A sulfonamide antibacterial indicated in the treatment of gastrointestinal infections.
https://go.drugbank.com/drugs/DB01022,Phylloquinone,https://go.drugbank.com/structures/DB01022/image.svg,A fat soluble vitamin used to treat hemorrhagic conditions in infants and coumarin overdoses.
https://go.drugbank.com/drugs/DB00981,Physostigmine,https://go.drugbank.com/structures/DB00981/image.svg,A cholinesterase inhibitor used to treat glaucoma and anticholinergic toxicity.
https://go.drugbank.com/drugs/DB13878,Pibrentasvir,https://go.drugbank.com/structures/DB13878/image.svg,A Hepatitis C NS5A inhibitor used to treat Hepatitis C.
https://go.drugbank.com/drugs/DB09268,Picosulfuric acid,https://go.drugbank.com/structures/DB09268/image.svg,A stimulant laxative used for cleansing of the colon as a preparation for colonoscopy in adults.
https://go.drugbank.com/drugs/DB03088,Pidolic acid,https://go.drugbank.com/structures/DB03088/image.svg,"There is currently no clinically approved and/or marketed medicine that relies upon pidolic acid as an active ingredient for any formal therapeutic indication.
Although pidolic acid may be sold in..."
https://go.drugbank.com/drugs/DB14805,Piflufolastat F 18,https://go.drugbank.com/structures/DB14805/image.svg,A radiopharmaceutical diagnostic agent used with PET to image PSMA-positive lesions for the diagnosis of metastatic or recurrent prostate cancer.
https://go.drugbank.com/drugs/DB01085,Pilocarpine,https://go.drugbank.com/structures/DB01085/image.svg,"A muscarinic agonist used to treat dry mouth and various ophthalmic conditions, such as presbyopia, increased intraocular pressure, and angle-closure glaucoma."
https://go.drugbank.com/drugs/DB05316,Pimavanserin,https://go.drugbank.com/structures/DB05316/image.svg,A second generation atypical antipsychotic used for the treatment of hallucinations and delusions caused by Parkinson's Disease.
https://go.drugbank.com/drugs/DB00337,Pimecrolimus,https://go.drugbank.com/structures/DB00337/image.svg,A topical calcineurin inhibitor used in the treatment of mild-moderate atopic dermatitis who are not candidates for other types of therapy due to previous lack of response or other reasons.
https://go.drugbank.com/drugs/DB13292,Pimethixene,https://go.drugbank.com/structures/DB13292/image.svg,Pimethixene is approved for use in Brazil and is marketed under the trade name Muricalm. It is an anticholinergic used in the treatment of bronchitis.
https://go.drugbank.com/drugs/DB01100,Pimozide,https://go.drugbank.com/structures/DB01100/image.svg,An antipsychotic used to manage debilitating motor and phonic tics in patients with Tourette's Disorder.
https://go.drugbank.com/drugs/DB06762,Pinacidil,https://go.drugbank.com/structures/DB06762/image.svg,"Pinacidil is a cyanoguanidine drug that acts by opening ATP-sensitive potassium channels, leading to peripheral vasodilatation of arterioles and decreasing peripheral vascular resistance. The above processes result in reduced blood..."
https://go.drugbank.com/drugs/DB09090,Pinaverium,https://go.drugbank.com/structures/DB09090/image.svg,A spasmolytic agent used for the symptomatic treatment of irritable bowel syndrome (IBS) and functional disorders of the biliary tract.
https://go.drugbank.com/drugs/DB00960,Pindolol,https://go.drugbank.com/structures/DB00960/image.svg,"A beta adrenoceptor antagonist used to treat hypertension, edema, ventricular tachycardias, and atrial fibrillation."
https://go.drugbank.com/drugs/DB01132,Pioglitazone,https://go.drugbank.com/structures/DB01132/image.svg,A thiazolidinedione used adjunctively with diet and exercise to normalize glycemic levels in adults with type 2 diabetes mellitus.
https://go.drugbank.com/drugs/DB01338,Pipecuronium,https://go.drugbank.com/structures/DB01338/image.svg,A nondepolarizing neuromuscular blocking agent used to relax muscles during anesthesia and surgical procedures.
https://go.drugbank.com/drugs/DB00319,Piperacillin,https://go.drugbank.com/structures/DB00319/image.svg,"A penicillin antibiotic combined with tazobactam to treat piperacillin-resistant, piperacillin/tazobactam­ susceptible, β-lactamase generating strains of several bacteria."
https://go.drugbank.com/drugs/DB13941,Piperaquine,https://go.drugbank.com/structures/DB13941/image.svg,"For the treatment of uncomplicated Plasmodium falciparum infection in adults, children, and infants aged 6 months and up weighing over 5 kg [FDA Label]. Used in combination with DB11638."
https://go.drugbank.com/drugs/DB00592,Piperazine,https://go.drugbank.com/structures/DB00592/image.svg,A medication used to treat roundworm and pinworm.
https://go.drugbank.com/drugs/DB09350,Piperonyl butoxide,https://go.drugbank.com/structures/DB09350/image.svg,"A pesticide used as a potentiator ingredient in the treatment of pediculosis (head lice, body lice or crabs) to boost efficacy of treatment."
https://go.drugbank.com/drugs/DB00236,Pipobroman,https://go.drugbank.com/structures/DB00236/image.svg,For the treatment of polycythaemia vera and refractory chronic myeloid leukaemia.
https://go.drugbank.com/drugs/DB01621,Pipotiazine,https://go.drugbank.com/structures/DB01621/image.svg,"An antipsychotic indicated for the management of chronic, non-agitated schizophrenic patients."
https://go.drugbank.com/drugs/DB11584,Pipradrol,https://go.drugbank.com/structures/DB11584/image.svg,A central nervous stimulant ingredient in a product used to treat functional fatigue.
https://go.drugbank.com/drugs/DB09210,Piracetam,https://go.drugbank.com/structures/DB09210/image.svg,"A nootropic cyclic GABA derivative used in myoclonus, sickle cell disease, alcohol dependence, and as a general cognitive enhancer."
https://go.drugbank.com/drugs/DB01291,Pirbuterol,https://go.drugbank.com/structures/DB01291/image.svg,A beta-2 adrenergic agonist and bronchodilator used for the symptomatic treatment of asthma.
https://go.drugbank.com/drugs/DB00670,Pirenzepine,https://go.drugbank.com/structures/DB00670/image.svg,"An antimuscarinic agent used to treat peptic ulcers, gastric ulcers, and duodenal ulcers."
https://go.drugbank.com/drugs/DB02925,Piretanide,https://go.drugbank.com/structures/DB02925/image.svg,"A loop diuretic used to manage essential arterial hypertension and edema cardiac, hepatic, and renal origin."
https://go.drugbank.com/drugs/DB04951,Pirfenidone,https://go.drugbank.com/structures/DB04951/image.svg,An agent used for the treatment of idiopathic pulmonary fibrosis (IPF).
https://go.drugbank.com/drugs/DB12492,Piritramide,https://go.drugbank.com/structures/DB12492/image.svg,A synthetic opioid used in the treatment of severe pain.
https://go.drugbank.com/drugs/DB00554,Piroxicam,https://go.drugbank.com/structures/DB00554/image.svg,An NSAID used to treat the symptoms of osteoarthritis and rheumatoid arthritis.
https://go.drugbank.com/drugs/DB17472,Pirtobrutinib,https://go.drugbank.com/structures/DB17472/image.svg,A kinase inhibitor used to treat relapsed or refractory mantle cell lymphoma (MCL) after at least two lines of systemic therapy.
https://go.drugbank.com/drugs/DB08860,Pitavastatin,https://go.drugbank.com/structures/DB08860/image.svg,An HMG-CoA reductase inhibitor used to lower lipid levels and reduce the risk of cardiovascular disease including myocardial infarction and stroke.
https://go.drugbank.com/drugs/DB11642,Pitolisant,https://go.drugbank.com/structures/DB11642/image.svg,An antagonist and inverse agonist at the histamine H3 receptor that is used to treat narcolepsy in adults.
https://go.drugbank.com/drugs/DB01604,Pivampicillin,https://go.drugbank.com/structures/DB01604/image.svg,An ampicillin prodrug used to treat a variety of infections.
https://go.drugbank.com/drugs/DB01605,Pivmecillinam,https://go.drugbank.com/structures/DB01605/image.svg,"A prodrug of the beta lactam antibiotic mecillinam, indicated for the treatment of uncomplicated urinary tract infections (UTIs)."
https://go.drugbank.com/drugs/DB06193,Pixantrone,https://go.drugbank.com/structures/DB06193/image.svg,An antineoplastic agent use to treat patients with relapsed or refractory aggressive Non-Hodgkin B-cell Lymphomas (NHL).
https://go.drugbank.com/drugs/DB06153,Pizotifen,https://go.drugbank.com/structures/DB06153/image.svg,A serotonin and tryptamine antagonist indicated for migraine prophylaxis.
https://go.drugbank.com/drugs/DB12615,Plazomicin,https://go.drugbank.com/structures/DB12615/image.svg,An aminoglycoside antibiotic used to treat complicated urinary tract infections.
https://go.drugbank.com/drugs/DB13170,Plecanatide,https://go.drugbank.com/structures/DB13170/image.svg,A laxative used to treat chronic idiopathic constipation and IBS with constipation.
https://go.drugbank.com/drugs/DB06809,Plerixafor,https://go.drugbank.com/structures/DB06809/image.svg,A CXCR4 antagonist used in combination with granulocyte-colony stimulating factor to mobilize hematopoietic stem cells to the peripheral blood for collection and autologous transplantation in patients with non-Hodgkin’s lymphoma and multiple myeloma.
https://go.drugbank.com/drugs/DB06810,Plicamycin,https://go.drugbank.com/structures/DB06810/image.svg,"For the treatment of testicular cancer, as well as hypercalcemia and hypercalciuria associated with a variety of advanced forms of cancer."
https://go.drugbank.com/drugs/DB01179,Podofilox,https://go.drugbank.com/structures/DB01179/image.svg,A topical agent used for the treatment of external genital warts and perianal warts.
https://go.drugbank.com/drugs/DB09094,Podophyllin,https://go.drugbank.com/structures/DB09094/image.svg,A cytotoxic agent used for the removal of soft genital (venereal) warts (condylomata acuminata).
https://go.drugbank.com/drugs/DB06811,Polidocanol,https://go.drugbank.com/structures/DB06811/image.svg,"A sclerosing agent used for the treatment of uncomplicated spider veins and uncomplicated reticular veins, all less than 3 mm in diameter, in the lower extremity."
https://go.drugbank.com/drugs/DB12277,Polihexanide,https://go.drugbank.com/structures/DB12277/image.svg,"Polihexanide has been used in trials studying the treatment, prevention, and supportive care of Caries, Neoplasm, Skin Diseases, Nail Diseases, and Dental Plaque, among others."
https://go.drugbank.com/drugs/DB11333,Poloxamer 188,https://go.drugbank.com/structures/DB11333/image.svg,A medication used to clean wounds.
https://go.drugbank.com/drugs/DB11263,Polydatin,https://go.drugbank.com/structures/DB11263/image.svg,"Polydatin, or Piceid, is a natural precursor and glycoside form of resveratrol with a monocrystalline structure. While it is isolated from the bark of Picea sitchensis or Polygonum cuspidatum, polydatin..."
https://go.drugbank.com/drugs/DB09369,Polyestradiol phosphate,https://go.drugbank.com/structures/DB09369/image.svg,Polymeric phosphoric acid ester of estradiol.
https://go.drugbank.com/drugs/DB09287,Polyethylene glycol,https://go.drugbank.com/structures/DB09287/image.svg,A laxative used to treat constipation and used for bowel preparation before colonoscopies and other procedures.
https://go.drugbank.com/drugs/DB11161,Polyethylene glycol 300,https://go.drugbank.com/structures/DB11161/image.svg,"Indicated as a lubricant in over-the-counter ophthalmic solutions to temporarily relieve redness, burning and irritation of the eyes."
https://go.drugbank.com/drugs/DB11077,Polyethylene glycol 400,https://go.drugbank.com/structures/DB11077/image.svg,"An ingredient used in a wide variety of medications, and is not an approved medication."
https://go.drugbank.com/drugs/DB00781,Polymyxin B,https://go.drugbank.com/structures/DB00781/image.svg,A polymyxin antibiotic used to treat a wide variety of infections in the body.
https://go.drugbank.com/drugs/DB11356,Polyquaternium-10 (400 cps at 2%),https://go.drugbank.com/structures/DB11356/image.svg,Polyquaternium-10 is a quaternized hydroxyethyl cellulose and a polycationic polymer. It is commonly found in cosmetics and personal care products to mainly reduce static electricity and form films.
https://go.drugbank.com/drugs/DB11271,Polysilicone-15,https://go.drugbank.com/structures/DB11271/image.svg,"Polysilicone-15 is used as an UV-filter in cosmetic sunscreen products as well as in other cosmetic products (like shampoos, conditioners, hairsprays, etc.) where it can confer photostability to the product(s)..."
https://go.drugbank.com/drugs/DB11178,Polysorbate 20,https://go.drugbank.com/structures/DB11178/image.svg,"Polysorbate 20 is a polysorbate-type nonionic surfactant used in many commercial, household and pharmaceutical products. It is composed of 20 repeated units of polyethylene glycol via ethoxylation. Polysorbate 20 is..."
https://go.drugbank.com/drugs/DB11063,Polysorbate 80,https://go.drugbank.com/structures/DB11063/image.svg,"It is used as a solubilizer, antimicrobial preservative and disinfectant ."
https://go.drugbank.com/drugs/DB01324,Polythiazide,https://go.drugbank.com/structures/DB01324/image.svg,A thiazide diuretic used in the management of hypertension and treatment of edema.
https://go.drugbank.com/drugs/DB11060,Polyvinyl alcohol,https://go.drugbank.com/structures/DB11060/image.svg,A compound used as an ophthalmic lubricant.
https://go.drugbank.com/drugs/DB08910,Pomalidomide,https://go.drugbank.com/structures/DB08910/image.svg,A thalidomide analogue used in combination with dexamethasone to treat patients with multiple myeloma.
https://go.drugbank.com/drugs/DB08901,Ponatinib,https://go.drugbank.com/structures/DB08901/image.svg,A kinase inhibitor used to treat patients with various types of chronic myeloid leukemia (CML).
https://go.drugbank.com/drugs/DB12016,Ponesimod,https://go.drugbank.com/structures/DB12016/image.svg,A sphingosine 1-phosphate receptor modulator indicated to treat relapsing multiple sclerosis.
https://go.drugbank.com/drugs/DB00707,Porfimer sodium,https://go.drugbank.com/structures/DB00707/image.svg,"A hematoporphyrin derivative used to treat esophageal cancer, endobronchial cancer, and high grade dysplasia in Barrett's Esophagus."
https://go.drugbank.com/drugs/DB01263,Posaconazole,https://go.drugbank.com/structures/DB01263/image.svg,A triazole antifungal drug that is used to treat invasive infections by Candida species and Aspergillus species in severely immunocompromised patients.
https://go.drugbank.com/drugs/DB14500,Potassium,https://go.drugbank.com/structures/DB14500/image.svg,A medication used to treat hypokalemic conditions and to clear the colon prior to colonoscopy.
https://go.drugbank.com/drugs/DB14498,Potassium acetate,https://go.drugbank.com/structures/DB14498/image.svg,A medication used to treat hypokalemia.
https://go.drugbank.com/drugs/DB09087,Potassium alum,https://go.drugbank.com/structures/DB09087/image.svg,"Potassium alum is considered safe by the FDA and its use is in homepathic or OTC products. Due to its presence in several different drugs, the main indications for the..."
https://go.drugbank.com/drugs/DB15819,Potassium aspartate,https://go.drugbank.com/structures/DB15819/image.svg,A potassium supplement used to treat hypokalemia or hyperammonemia.
https://go.drugbank.com/drugs/DB11098,Potassium bicarbonate,https://go.drugbank.com/structures/DB11098/image.svg,An ingredient used as an antacid or to treat hypokalemia.
https://go.drugbank.com/drugs/DB13977,Potassium carbonate,https://go.drugbank.com/structures/DB13977/image.svg,"Potassium carbonate (K2CO3) is a white salt, soluble in water (insoluble in ethanol) which forms a strongly alkaline solution. It can be made as the product of potassium hydroxide's absorbent..."
https://go.drugbank.com/drugs/DB01345,Potassium cation,https://go.drugbank.com/structures/DB01345/image.svg,Potassium is used to regulate hypokalemia as a primary condition or secondary to other medical conditions.
https://go.drugbank.com/drugs/DB00761,Potassium chloride,https://go.drugbank.com/structures/DB00761/image.svg,A potassium salt used to treat hypokalemia.
https://go.drugbank.com/drugs/DB09125,Potassium citrate,https://go.drugbank.com/structures/DB09125/image.svg,"An agent used to manage renal tubular acidosis, hypocitraturic calcium oxalate nephrolithiasis, and uric acid lithiasis with or without calcium stones."
https://go.drugbank.com/drugs/DB13620,Potassium gluconate,https://go.drugbank.com/structures/DB13620/image.svg,A potassium supplement indicated in the treatment and prevention of hypokalemia.
https://go.drugbank.com/drugs/DB11153,Potassium hydroxide,https://go.drugbank.com/structures/DB11153/image.svg,"A disinfectant used to clean hands, skin, and surfaces."
https://go.drugbank.com/drugs/DB06715,Potassium Iodide,https://go.drugbank.com/structures/DB06715/image.svg,An oral antithyroid agent used for the prevention of radioactive iodine uptake into the thyroid gland during a nuclear radiation emergency.
https://go.drugbank.com/drugs/DB09483,Potassium lactate,https://go.drugbank.com/structures/DB09483/image.svg,Not Annotated
https://go.drugbank.com/drugs/DB11090,Potassium nitrate,https://go.drugbank.com/structures/DB11090/image.svg,"A medication used to cauterize small wounds, remove granulation tissue, warts, and verrucae, and treat tooth sensitivity."
https://go.drugbank.com/drugs/DB09418,Potassium perchlorate,https://go.drugbank.com/structures/DB09418/image.svg,No current FDA- or EMA-approved therapeutic indications.
https://go.drugbank.com/drugs/DB14499,Potassium sulfate,https://go.drugbank.com/structures/DB14499/image.svg,An osmotic laxative used to cleanse the colon before a colonoscopy.
https://go.drugbank.com/drugs/DB11061,Povidone,https://go.drugbank.com/structures/DB11061/image.svg,"When in complex with iodine, indicated for inducing antisepsis for prevention of infection in minor cuts, scrapes, and burns."
https://go.drugbank.com/drugs/DB14478,Povidone K30,https://go.drugbank.com/structures/DB14478/image.svg,"When in complex with iodine, indicated for inducing antisepsis for prevention of infection in minor cuts, scrapes, and burns."
https://go.drugbank.com/drugs/DB06812,Povidone-iodine,https://go.drugbank.com/structures/DB06812/image.svg,A topical antiseptic agent used for the treatment and prevention of infection in wounds.
https://go.drugbank.com/drugs/DB01297,Practolol,https://go.drugbank.com/structures/DB01297/image.svg,Used in the emergency treatment of cardiac arrhythmias.
https://go.drugbank.com/drugs/DB06813,Pralatrexate,https://go.drugbank.com/structures/DB06813/image.svg,An antineoplastic agent used for the treatment of relapsed or refractory peripheral T-cell lymphoma.
https://go.drugbank.com/drugs/DB00733,Pralidoxime,https://go.drugbank.com/structures/DB00733/image.svg,A cholinesterase reactivator used to treat organophosphate poisoning.
https://go.drugbank.com/drugs/DB15822,Pralsetinib,https://go.drugbank.com/structures/DB15822/image.svg,A RET receptor tyrosine kinase inhibitor for the treatment of metastatic RET-driven non-small cell lung cancer.
https://go.drugbank.com/drugs/DB00413,Pramipexole,https://go.drugbank.com/structures/DB00413/image.svg,A non-ergot dopamine agonist used to treat the signs and symptoms of idiopathic Parkinson's disease and Restless Legs Syndrome (RLS).
https://go.drugbank.com/drugs/DB13247,Pramiracetam,https://go.drugbank.com/structures/DB13247/image.svg,"Pramiracetam has been previously approved in some eastern European countries under the brand names Pramistar, Neupramir, and Remen. It was also previously approved in the United States with orphan drug..."
https://go.drugbank.com/drugs/DB01278,Pramlintide,https://go.drugbank.com/structures/DB01278/image.svg,An amylin analog used for the management of type 1 and type 2 diabetes mellitus as an adjunct to preprandial insulin therapy in patients without adequate glycemic control of insulin therapy.
https://go.drugbank.com/drugs/DB09345,Pramocaine,https://go.drugbank.com/structures/DB09345/image.svg,A local anesthetic and antipruritic agent found in various topical preparations.
https://go.drugbank.com/drugs/DB01708,Prasterone,https://go.drugbank.com/structures/DB01708/image.svg,A steroid formulated as a vaginal insert indicated for the treatment of moderate to severe dyspareunia associated with menopausal vulvar and vaginal atrophy.
https://go.drugbank.com/drugs/DB16625,Prasterone enantate,https://go.drugbank.com/structures/DB16625/image.svg,An estrogen indicated for hormone replacement therapy in postmenopausal women.
