Link,GName,Structure,Description
https://go.drugbank.com/drugs/DB06218,Lacosamide,https://go.drugbank.com/structures/DB06218/image.svg,An antiepileptic drug used to treat partial-onset seizures and primary generalized tonic-clonic seizures.
https://go.drugbank.com/drugs/DB04398,Lactic acid,https://go.drugbank.com/structures/DB04398/image.svg,An emollient and keratolytic used agent in various cosmetic products and used as an additive in various pharmaceutical products for its antibacterial properties.
https://go.drugbank.com/drugs/DB12942,Lactitol,https://go.drugbank.com/structures/DB12942/image.svg,An orally administered osmotic laxative used to treat chronic idiopathic constipation.
https://go.drugbank.com/drugs/DB16540,Lactobacillus delbrueckii bulgaricus,https://go.drugbank.com/structures/DB16540/image.svg,Not Annotated
https://go.drugbank.com/drugs/DB04465,Lactose,https://go.drugbank.com/structures/DB04465/image.svg,An additive and filler found in various products to maintain structure and consistency.
https://go.drugbank.com/drugs/DB00581,Lactulose,https://go.drugbank.com/structures/DB00581/image.svg,A disaccharide derivative of lactose used to treat constipation and portal systemic encephalopathy.
https://go.drugbank.com/drugs/DB00709,Lamivudine,https://go.drugbank.com/structures/DB00709/image.svg,A reverse transcriptase inhibitor used to treat HIV and hepatitis B infections.
https://go.drugbank.com/drugs/DB00555,Lamotrigine,https://go.drugbank.com/structures/DB00555/image.svg,A phenyltriazine antiepileptic used to treat some types of epilepsy and bipolar I disorder.
https://go.drugbank.com/drugs/DB11112,Lanolin,https://go.drugbank.com/structures/DB11112/image.svg,An ingredient used in skin care products to relieve irritation.
https://go.drugbank.com/drugs/DB14181,Lanolin alcohols,https://go.drugbank.com/structures/DB14181/image.svg,Lanolin alcohols are a complex combination of organic alcohols obtained by the hydrolysis of lanolin. It is administered as an ointment base with topical insulin and has shown to be...
https://go.drugbank.com/drugs/DB06791,Lanreotide,https://go.drugbank.com/structures/DB06791/image.svg,"A somatostatin analog used for the treatment of unresectable, well- or moderately-differentiated, locally advanced or metastatic gastroenteropancreatic neuroendocrine tumors and acromegaly."
https://go.drugbank.com/drugs/DB00448,Lansoprazole,https://go.drugbank.com/structures/DB00448/image.svg,"A proton pump inhibitor used to help gastrointestinal ulcers heal, to treat symptoms of gastroesophageal reflux disease (GERD), to eradicate Helicobacter pylori, and to treat hypersecretory conditions such as Zollinger-Ellison Syndrome."
https://go.drugbank.com/drugs/DB06792,Lanthanum carbonate,https://go.drugbank.com/structures/DB06792/image.svg,A phosphate binder indicated for the reduction of serum phosphate in patients with end stage renal disease.
https://go.drugbank.com/drugs/DB01259,Lapatinib,https://go.drugbank.com/structures/DB01259/image.svg,An antineoplastic agent and tyrosine kinase inhibitor used for the treatment of advanced or metastatic HER-positive breast cancer in patients who received prior chemotherapeutic treatments.
https://go.drugbank.com/drugs/DB09376,Lapyrium,https://go.drugbank.com/structures/DB09376/image.svg,"Used as a surfactant, antistatic agent, and biocide in cosmetic products ."
https://go.drugbank.com/drugs/DB11629,Laropiprant,https://go.drugbank.com/structures/DB11629/image.svg,Laropiprant is an ingredient in the EMA-withdrawn product Pelzont.
https://go.drugbank.com/drugs/DB14723,Larotrectinib,https://go.drugbank.com/structures/DB14723/image.svg,"A kinase inhibitor used to treat solid tumors with neurotrophic receptor tyrosine kinase gene fusion, are metastatic, high risk for surgery, or have no alternative treatments."
https://go.drugbank.com/drugs/DB11732,Lasmiditan,https://go.drugbank.com/structures/DB11732/image.svg,An oral 5HT1F agonist used for the acute treatment of migraine headache with or without aura.
https://go.drugbank.com/drugs/DB06202,Lasofoxifene,https://go.drugbank.com/structures/DB06202/image.svg,"Investigated for use/treatment in postmenopausal osteoporosis to reduce the risk of both vertebral and novertebral fractures, as well as address other postmenopausal conditions, including reduction in risk of breast cancer..."
https://go.drugbank.com/drugs/DB04570,Latamoxef,https://go.drugbank.com/structures/DB04570/image.svg,"Latamoxef is an oxacephem antibiotic usually grouped with the cephalosporins. It is used to treat bacterial infections. Latamoxef is primarily indicated in conditions like Bone and joint infection, GI infections,..."
https://go.drugbank.com/drugs/DB00654,Latanoprost,https://go.drugbank.com/structures/DB00654/image.svg,An isopropyl ester prodrug used to treat increased intraocular pressure.
https://go.drugbank.com/drugs/DB11660,Latanoprostene bunod,https://go.drugbank.com/structures/DB11660/image.svg,A prostaglandin analog used to reduce ocular hypertension or treat open-angle glaucoma.
https://go.drugbank.com/drugs/DB03017,Lauric acid,https://go.drugbank.com/structures/DB03017/image.svg,"Lauric acid is an inexpensive, non-toxic and safe to handle compound often used in laboratory investigations of melting-point depression. Lauric acid is a solid at room temperature but melts easily..."
https://go.drugbank.com/drugs/DB17308,Laurocapram,https://go.drugbank.com/structures/DB17308/image.svg,Not Annotated
https://go.drugbank.com/drugs/DB09027,Ledipasvir,https://go.drugbank.com/structures/DB09027/image.svg,A direct-acting antiviral agent used to treat specific hepatitis C virus (HCV) infections in combination with other antiviral agents.
https://go.drugbank.com/drugs/DB12825,Lefamulin,https://go.drugbank.com/structures/DB12825/image.svg,A pleuromutilin antibacterial used to treat community-acquired bacterial pneumonia (CABP).
https://go.drugbank.com/drugs/DB01097,Leflunomide,https://go.drugbank.com/structures/DB01097/image.svg,A pyrimidine synthesis inhibitor indicated to treat rheumatoid arthritis.
https://go.drugbank.com/drugs/DB11951,Lemborexant,https://go.drugbank.com/structures/DB11951/image.svg,A dual orexin antagonist indicated for the treatment of sleep-onset and/or sleep maintenance insomnia.
https://go.drugbank.com/drugs/DB15673,Lenacapavir,https://go.drugbank.com/structures/DB15673/image.svg,A first-in-class capsid inhibitor being investigated for use in HIV-1 treatment.
https://go.drugbank.com/drugs/DB00480,Lenalidomide,https://go.drugbank.com/structures/DB00480/image.svg,A thalidomide derivative used to treat multiple myeloma and anemia in low to intermediate risk myelodysplastic syndrome.
https://go.drugbank.com/drugs/DB16217,Leniolisib,https://go.drugbank.com/structures/DB16217/image.svg,A phosphoinositide 3-kinase-delta inhibitor that is used to treat activated phosphoinositide 3-kinase delta syndrome.
https://go.drugbank.com/drugs/DB09078,Lenvatinib,https://go.drugbank.com/structures/DB09078/image.svg,"A receptor tyrosine kinase inhibitor used for the treatment of metastatic thyroid cancer, advanced renal cell carcinoma in combination with everolimus, and unresectable hepatocellular carcinoma."
https://go.drugbank.com/drugs/DB00528,Lercanidipine,https://go.drugbank.com/structures/DB00528/image.svg,A calcium channel blocker for the management of hypertension.
https://go.drugbank.com/drugs/DB11560,Lesinurad,https://go.drugbank.com/structures/DB11560/image.svg,A uric acid 1 transporter inhibitor typically used in combination with a xanthine oxidase inhibitor to treat hyperuricemia associated with gout in patients with inadequate control of uric acid levels with xanthine oxidase inhibitor monotherapy.
https://go.drugbank.com/drugs/DB12070,Letermovir,https://go.drugbank.com/structures/DB12070/image.svg,An antiviral medication used for prophylaxis in adult transplant recipients at risk of cytomegalovirus (CMV) infection and disease.
https://go.drugbank.com/drugs/DB01006,Letrozole,https://go.drugbank.com/structures/DB01006/image.svg,An aromatase inhibitor used to treat breast cancer in postmenopausal women.
https://go.drugbank.com/drugs/DB00650,Leucovorin,https://go.drugbank.com/structures/DB00650/image.svg,"A folate analog used to treat the toxic effects of methotrexate and other folate antagonists, to treat megaloblastic anemia, and to provide palliative treatment of colorectal cancer."
https://go.drugbank.com/drugs/DB00007,Leuprolide,https://go.drugbank.com/structures/DB00007/image.svg,"A peptide-based GnRH receptor superagonist used for the palliative treatment of prostate cancer, uterine leiomyomata, endometriosis, and central precocious puberty."
https://go.drugbank.com/drugs/DB01227,Levacetylmethadol,https://go.drugbank.com/structures/DB01227/image.svg,For the treatment and management of opiate dependence. It is sometimes used to treat severe pain in terminal patients.
https://go.drugbank.com/drugs/DB00504,Levallorphan,https://go.drugbank.com/structures/DB00504/image.svg,"For the complete or partial reversal of narcotic depression, including respiratory depression, induced by opioids."
https://go.drugbank.com/drugs/DB00848,Levamisole,https://go.drugbank.com/structures/DB00848/image.svg,Levamisole is a nicotinic receptor agonist used to treat helminth infections and some skin infections.
https://go.drugbank.com/drugs/DB09237,Levamlodipine,https://go.drugbank.com/structures/DB09237/image.svg,A calcium channel blocker used to treat hypertension.
https://go.drugbank.com/drugs/DB01202,Levetiracetam,https://go.drugbank.com/structures/DB01202/image.svg,"A novel anticonvulsant agent used as an adjunct medication to manage partial onset, myoclonic, and generalized tonic-clonic seizures in patients with epilepsy."
https://go.drugbank.com/drugs/DB09571,Levmetamfetamine,https://go.drugbank.com/structures/DB09571/image.svg,Used over-the-counter for nasal congestion.
https://go.drugbank.com/drugs/DB09351,Levobetaxolol,https://go.drugbank.com/structures/DB09351/image.svg,Used in the treatment of open-angle glaucoma and ocular hypertension [FDA Label].
https://go.drugbank.com/drugs/DB01210,Levobunolol,https://go.drugbank.com/structures/DB01210/image.svg,A beta-adrenergic antagonist used for the reduction of elevated intraocular pressure in patients with ocular hypertension or open-angle glaucoma.
https://go.drugbank.com/drugs/DB01002,Levobupivacaine,https://go.drugbank.com/structures/DB01002/image.svg,A drug used for nerve block and anesthesia.
https://go.drugbank.com/drugs/DB01106,Levocabastine,https://go.drugbank.com/structures/DB01106/image.svg,A selective histamine H1 receptor antagonist indicated for the management of seasonal allergic conjunctivitis symptoms.
https://go.drugbank.com/drugs/DB00583,Levocarnitine,https://go.drugbank.com/structures/DB00583/image.svg,A quaternary ammonium compound used to treat carnitine deficiency or to stimulate gastric and pancreatic secretions in hyperlipoproteinemia.
https://go.drugbank.com/drugs/DB06282,Levocetirizine,https://go.drugbank.com/structures/DB06282/image.svg,An H1-receptor antagonist used to treat symptoms associated with chronic allergic rhinitis and uncomplicated cases of chronic idiopathic urticaria.
https://go.drugbank.com/drugs/DB01235,Levodopa,https://go.drugbank.com/structures/DB01235/image.svg,"A dopamine precursor used in the management of Parkinson's disease, often in combination with carbidopa, as well as other conditions associated with parkinsonism."
https://go.drugbank.com/drugs/DB01137,Levofloxacin,https://go.drugbank.com/structures/DB01137/image.svg,"A fluoroquinolone antibiotic used to treat infections caused by susceptible bacteria of the upper respiratory tract, skin and skin structures, urinary tract, and prostate, as well as for post-exposure treatment of inhaled anthrax and the plague."
https://go.drugbank.com/drugs/DB05667,Levoketoconazole,https://go.drugbank.com/structures/DB05667/image.svg,One of two enantiomeric forms of racemic ketoconazole that strongly inhibits multiple steroidogenic enzymes and is used for the symptomatic treatment of endogenous Cushing's syndrome.
https://go.drugbank.com/drugs/DB11596,Levoleucovorin,https://go.drugbank.com/structures/DB11596/image.svg,"A folate analog used after high dose methotrexate for osteosarcoma, to reduce the toxic effects of folate analogs, and with 5-fluorouracil in palliative treatment of advanced metastatic colorectal cancer."
https://go.drugbank.com/drugs/DB11256,Levomefolic acid,https://go.drugbank.com/structures/DB11256/image.svg,A folate supplement used to prevent neural tube defects in pregnancy or folate deficiency.
https://go.drugbank.com/drugs/DB13153,Levomenol,https://go.drugbank.com/structures/DB13153/image.svg,"Levomenol has been known to elicit a number of potentially beneficial pharmacological effects, including anti-irritant, anti-inflammatory, and anti-microbial actions. Bisabolol is also demonstrated to enhance the percutaneous absorption of certain..."
https://go.drugbank.com/drugs/DB00825,Levomenthol,https://go.drugbank.com/structures/DB00825/image.svg,An organic compound used to treat mild to moderate muscle and joint pain.
https://go.drugbank.com/drugs/DB08918,Levomilnacipran,https://go.drugbank.com/structures/DB08918/image.svg,A selective serotonin and norepinephrine reuptake inhibitor (SNRI) used to treat major depressive disorder (MDD) in adults.
https://go.drugbank.com/drugs/DB06707,Levonordefrin,https://go.drugbank.com/structures/DB06707/image.svg,A topical sympathomimetic amine found in local anesthetic products that is used for nasal decongestion or vasoconstriction during dental procedures.
https://go.drugbank.com/drugs/DB00367,Levonorgestrel,https://go.drugbank.com/structures/DB00367/image.svg,A progestin found in oral and IUD contraceptives and at higher doses in emergency contraceptives.
https://go.drugbank.com/drugs/DB00854,Levorphanol,https://go.drugbank.com/structures/DB00854/image.svg,An opioid analgesic used to treat moderate to severe pain.
https://go.drugbank.com/drugs/DB13139,Levosalbutamol,https://go.drugbank.com/structures/DB13139/image.svg,A beta-2 adrenergic receptor agonist used to treat COPD and asthma.
https://go.drugbank.com/drugs/DB00922,Levosimendan,https://go.drugbank.com/structures/DB00922/image.svg,A calcium sensitizer indicated to treat acutely decompensated severe chronic heart failure.
https://go.drugbank.com/drugs/DB00451,Levothyroxine,https://go.drugbank.com/structures/DB00451/image.svg,A synthetic T4 hormone used to treat hypothyroidism that can be used along with surgery and radioiodine therapy to manage thyrotropin-dependent well-differentiated thyroid cancer.
https://go.drugbank.com/drugs/DB00281,Lidocaine,https://go.drugbank.com/structures/DB00281/image.svg,A local anesthetic used in a wide variety of superficial and invasive procedures.
https://go.drugbank.com/drugs/DB13766,Lidoflazine,https://go.drugbank.com/structures/DB13766/image.svg,Not Annotated
https://go.drugbank.com/drugs/DB11611,Lifitegrast,https://go.drugbank.com/structures/DB11611/image.svg,A medication used to treat dry eye disease.
https://go.drugbank.com/drugs/DB11183,Light green SF yellowish,https://go.drugbank.com/structures/DB11183/image.svg,Light green SF yellowish is a green triarylmethane dye that is used in the preparation of the staining solution which is widely used as a counterstain. It is used in...
https://go.drugbank.com/drugs/DB11579,Light mineral oil,https://go.drugbank.com/structures/DB11579/image.svg,"An oil used to hydrate dry, itchy skin, hemorrhoids, and dry eyes."
https://go.drugbank.com/drugs/DB08890,Linaclotide,https://go.drugbank.com/structures/DB08890/image.svg,"A guanylate cyclase-C agonist used to treat different types of constipation, such as irritable bowel syndrome-related constipation, idiopathic constipation, and functional constipation."
https://go.drugbank.com/drugs/DB08882,Linagliptin,https://go.drugbank.com/structures/DB08882/image.svg,A dipeptidyl peptidase-4 (DPP-4) inhibitor used to manage hyperglycemia in patients with type 2 diabetes mellitus.
https://go.drugbank.com/drugs/DB01627,Lincomycin,https://go.drugbank.com/structures/DB01627/image.svg,An antibiotic indicated only for the treatment of serious infections and is typically reserved for use in cases of penicillin allergy or where penicillin is inappropriate.
https://go.drugbank.com/drugs/DB00431,Lindane,https://go.drugbank.com/structures/DB00431/image.svg,An ectoparasiticide and ovicide used in the treatment of Pediculosis humanis capitis (head lice) and Phthirus pubis (crab lice).
https://go.drugbank.com/drugs/DB00601,Linezolid,https://go.drugbank.com/structures/DB00601/image.svg,An oxazolidinone antibiotic used to treat infections by susceptible strains of aerobic Gram-positive bacteria.
https://go.drugbank.com/drugs/DB14104,Linoleic acid,https://go.drugbank.com/structures/DB14104/image.svg,Not Annotated
https://go.drugbank.com/drugs/DB17083,Linzagolix,https://go.drugbank.com/structures/DB17083/image.svg,A selective gonadotropin-releasing hormone (GnRH) receptor antagonist used for the symptomatic treatment of uterine fibroids.
https://go.drugbank.com/drugs/DB00279,Liothyronine,https://go.drugbank.com/structures/DB00279/image.svg,"A thyroid hormone replacement therapy used to treat hypothyroidism, to suppress TSH, and to help in the diagnosis of hyperthyroidism."
https://go.drugbank.com/drugs/DB01583,Liotrix,https://go.drugbank.com/structures/DB01583/image.svg,"May be used to treat primary, secondary or tertiary hypothyroidism. May also be used to suppress thyroid stimulating hormone (TSH) secretion in patients with simple (nontoxic) goiter, subacute or chronic..."
https://go.drugbank.com/drugs/DB00166,Lipoic acid,https://go.drugbank.com/structures/DB00166/image.svg,"For nutritional supplementation, also for treating dietary shortage or imbalance."
https://go.drugbank.com/drugs/DB01255,Lisdexamfetamine,https://go.drugbank.com/structures/DB01255/image.svg,A central nervous system (CNS) stimulant used to treat attention deficit hyperactivity disorder (ADHD) and moderate to severe eating disorders.
https://go.drugbank.com/drugs/DB00722,Lisinopril,https://go.drugbank.com/structures/DB00722/image.svg,"An ACE inhibitor used to treat hypertension, heart failure, and acute myocardial infarction."
https://go.drugbank.com/drugs/DB00589,Lisuride,https://go.drugbank.com/structures/DB00589/image.svg,For the management of Parkinson's Disease
https://go.drugbank.com/drugs/DB14509,Lithium carbonate,https://go.drugbank.com/structures/DB14509/image.svg,A medication used to treat manic episodes of bipolar disorder.
https://go.drugbank.com/drugs/DB14507,Lithium citrate,https://go.drugbank.com/structures/DB14507/image.svg,"Lithium is used as a mood stabilizer, and is used for treatment of depression and mania. It is often used in bipolar disorder treatment."
https://go.drugbank.com/drugs/DB14506,Lithium hydroxide,https://go.drugbank.com/structures/DB14506/image.svg,Used for tryptophan determinations in proteins &amp; foods.
https://go.drugbank.com/drugs/DB06794,Lodoxamide,https://go.drugbank.com/structures/DB06794/image.svg,"An ophthalmic agent used for the treatment of the ocular disorders referred to by the terms vernal keratoconjunctivitis, vernal conjunctivitis, and vernal keratitis."
https://go.drugbank.com/drugs/DB04948,Lofexidine,https://go.drugbank.com/structures/DB04948/image.svg,A centrally acting alpha2-adrenergic agonist used for the symptomatic treatment of acute opioid withdrawal syndrome to facilitate abrupt opioid discontinuation in adults.
https://go.drugbank.com/drugs/DB00978,Lomefloxacin,https://go.drugbank.com/structures/DB00978/image.svg,A fluoroquinolone used to prevent and treat a wide variety of infections in the body.
https://go.drugbank.com/drugs/DB18002,Lomifylline,https://go.drugbank.com/structures/DB18002/image.svg,Not Annotated
https://go.drugbank.com/drugs/DB08827,Lomitapide,https://go.drugbank.com/structures/DB08827/image.svg,"A microsomal triglyceride transfer protein inhibitor used to lower cholesterol associated with homozygous familial hypercholesterolemia (HoFH), reducing risk of cardiovascular events such as myocardial infarction and stroke."
https://go.drugbank.com/drugs/DB01206,Lomustine,https://go.drugbank.com/structures/DB01206/image.svg,An alkylating agent used as a part of chemotherapeutic regimens for the treatment of primary and metastatic brain tumors as well as refractory or relapsed Hodgkin's disease in addition to surgical and/or radiotherapeutic treatments.
https://go.drugbank.com/drugs/DB06448,Lonafarnib,https://go.drugbank.com/structures/DB06448/image.svg,A potent farnesyl transferase inhibitor used to reduce mortality associated with Hutchinson-Gilford progeria syndrome (HGPS) and other progeroid laminopathies.
https://go.drugbank.com/drugs/DB00836,Loperamide,https://go.drugbank.com/structures/DB00836/image.svg,"A long acting antidiarrheal used to control nonspecific diarrhea and chronic diarrhea caused by inflammatory bowel disease, or gastroenteritis."
https://go.drugbank.com/drugs/DB01601,Lopinavir,https://go.drugbank.com/structures/DB01601/image.svg,An HIV-1 protease inhibitor used in combination with ritonavir to treat human immunodeficiency virus (HIV) infection.
https://go.drugbank.com/drugs/DB00447,Loracarbef,https://go.drugbank.com/structures/DB00447/image.svg,"Used to treat upper respiratory tract bacterial infections, chronic bronchitis, pneumonia, sinusitis, pharyntitis and tonsillitis, skin absceses, urinary tract infections and pyelonephritis caused by E. coli, S. pyogenes, S. aureus,..."
https://go.drugbank.com/drugs/DB00455,Loratadine,https://go.drugbank.com/structures/DB00455/image.svg,A second generation antihistamine used to manage the symptoms of allergic rhinitis.
https://go.drugbank.com/drugs/DB00186,Lorazepam,https://go.drugbank.com/structures/DB00186/image.svg,"A short-acting benzodiazepine commonly used to treat panic disorders, severe anxiety, and seizures."
https://go.drugbank.com/drugs/DB04871,Lorcaserin,https://go.drugbank.com/structures/DB04871/image.svg,"A serotonin 2C receptor agonist used in conjunction with physical activity and calorie restriction for weight loss in obese patients with a body mass index (BMI) of 30 and above, and in overweight patients with weight-related comorbidities."
https://go.drugbank.com/drugs/DB12130,Lorlatinib,https://go.drugbank.com/structures/DB12130/image.svg,An anaplastic lymphoma kinase inhibitor used to treat anaplastic lymphoma kinase positive metastatic non small cell lung cancer.
https://go.drugbank.com/drugs/DB13872,Lormetazepam,https://go.drugbank.com/structures/DB13872/image.svg,A benzodiazepine indicated in the treatment of anxiety and the induction of anesthesia.
https://go.drugbank.com/drugs/DB06725,Lornoxicam,https://go.drugbank.com/structures/DB06725/image.svg,"An NSAID indicated in the treatment of mild to moderate pain, as well as rheumatoid arthritis and osteoarthritis."
https://go.drugbank.com/drugs/DB09195,Lorpiprazole,https://go.drugbank.com/structures/DB09195/image.svg,"In 2016, lorpiprazole was classified in the ""Chemical structure-related drug-like criteria of global approved drugs"" as an antipsychotic and anxiolytic. An antipsychotic is a medication used to treat a state..."
https://go.drugbank.com/drugs/DB00678,Losartan,https://go.drugbank.com/structures/DB00678/image.svg,"An angiotensin receptor blocker used to treat hypertension and diabetic nephropathy, and is used to reduce the risk of stroke."
https://go.drugbank.com/drugs/DB00873,Loteprednol,https://go.drugbank.com/structures/DB00873/image.svg,A corticosteroid indicated in the treatment of pain and inflammation after cataract surgery.
https://go.drugbank.com/drugs/DB14596,Loteprednol etabonate,https://go.drugbank.com/structures/DB14596/image.svg,A corticosteroid used to treat allergic conjunctivitis as well as inflammation and pain after ocular surgery.
https://go.drugbank.com/drugs/DB17992,Lotilaner,https://go.drugbank.com/structures/DB17992/image.svg,An antiparasitic agent used to treat Demodex blepharitis.
https://go.drugbank.com/drugs/DB00227,Lovastatin,https://go.drugbank.com/structures/DB00227/image.svg,"An HMG-CoA reductase inhibitor used to lower LDL cholesterol and reduce the risk of cardiovascular disease and associated conditions, including myocardial infarction and stroke."
https://go.drugbank.com/drugs/DB00408,Loxapine,https://go.drugbank.com/structures/DB00408/image.svg,A antipsychotic used for the treatment of schizophrenia.
https://go.drugbank.com/drugs/DB09212,Loxoprofen,https://go.drugbank.com/structures/DB09212/image.svg,An NSAID used to treat pain and inflammation in musculoskeletal conditions.
https://go.drugbank.com/drugs/DB01046,Lubiprostone,https://go.drugbank.com/structures/DB01046/image.svg,A prostaglandin derivative used to treat constipation caused by irritable bowel syndrome and opioid-use.
https://go.drugbank.com/drugs/DB08933,Luliconazole,https://go.drugbank.com/structures/DB08933/image.svg,A topical antifungal agent used to treat fungal infections.
https://go.drugbank.com/drugs/DB09280,Lumacaftor,https://go.drugbank.com/structures/DB09280/image.svg,A protein chaperone used in combination with ivacaftor for the treatment of cystic fibrosis in patients who are homozygous for the F508del mutation in the CFTR gene.
https://go.drugbank.com/drugs/DB06077,Lumateperone,https://go.drugbank.com/structures/DB06077/image.svg,A novel 2nd generation antipsychotic used to manage both positive and negative symptoms in patients with schizophrenia.
https://go.drugbank.com/drugs/DB06708,Lumefantrine,https://go.drugbank.com/structures/DB06708/image.svg,An antimalarial agent used in combination with artemether for the treatment of acute uncomplicated malaria caused by Plasmodium falciparum.
