Link,GName,Structure,Description
https://go.drugbank.com/drugs/DB06699,Degarelix,https://go.drugbank.com/structures/DB06699/image.svg,A GnRH receptor antagonist used in the management of advanced prostate cancer.
https://go.drugbank.com/drugs/DB11622,Dehydrocholic acid,https://go.drugbank.com/structures/DB11622/image.svg,No approved therapeutic indications.
https://go.drugbank.com/drugs/DB11943,Delafloxacin,https://go.drugbank.com/structures/DB11943/image.svg,A fluoroquinolone antibiotic used to treat skin and skin structure infections.
https://go.drugbank.com/drugs/DB11637,Delamanid,https://go.drugbank.com/structures/DB11637/image.svg,An antibiotic used to treat multidrug resistant tuberculosis.
https://go.drugbank.com/drugs/DB00705,Delavirdine,https://go.drugbank.com/structures/DB00705/image.svg,A non-nucleoside reverse transcriptase inhibitor used to treat HIV infection.
https://go.drugbank.com/drugs/DB00944,Demecarium,https://go.drugbank.com/structures/DB00944/image.svg,For the topical treatment of chronic open-angle glaucoma.
https://go.drugbank.com/drugs/DB00618,Demeclocycline,https://go.drugbank.com/structures/DB00618/image.svg,A tetracycline antibiotic used to treat a wide variety of susceptible bacterial infections.
https://go.drugbank.com/drugs/DB03619,Deoxycholic acid,https://go.drugbank.com/structures/DB03619/image.svg,A cytolytic agent injected subcutaneously to improve the appearance submental fat.
https://go.drugbank.com/drugs/DB04209,Dequalinium,https://go.drugbank.com/structures/DB04209/image.svg,"A quaternary ammonium cation antimicrobial agent used to treat common infections of the mouth and throat, as well as vaginal candidiasis."
https://go.drugbank.com/drugs/DB01089,Deserpidine,https://go.drugbank.com/structures/DB01089/image.svg,An alkaloid that has been used to manage hypertension.
https://go.drugbank.com/drugs/DB01189,Desflurane,https://go.drugbank.com/structures/DB01189/image.svg,A general inhalation anesthetic for inpatient and outpatient surgery in adults.
https://go.drugbank.com/drugs/DB01151,Desipramine,https://go.drugbank.com/structures/DB01151/image.svg,A tricyclic antidepressant used in the treatment of depression.
https://go.drugbank.com/drugs/DB01078,Deslanoside,https://go.drugbank.com/structures/DB01078/image.svg,"For the treatment and management of Congestive cardiac insufficiency, arrhythmias and heart failure."
https://go.drugbank.com/drugs/DB00967,Desloratadine,https://go.drugbank.com/structures/DB00967/image.svg,"A second generation tricyclic antihistamine used to treat seasonal and non seasonal allergic rhinitis, pruritus, and urticaria."
https://go.drugbank.com/drugs/DB00035,Desmopressin,https://go.drugbank.com/structures/DB00035/image.svg,A synthetic analog of vasopressin used to reduce renal excretion of water in central diabetes insipidus and nocturia.
https://go.drugbank.com/drugs/DB00304,Desogestrel,https://go.drugbank.com/structures/DB00304/image.svg,"A synthetic progestin used in contraception, often in combination with ethinyl estradiol."
https://go.drugbank.com/drugs/DB01260,Desonide,https://go.drugbank.com/structures/DB01260/image.svg,A topical corticosteroid used for the symptomatic treatment of inflammatory and pruritic manifestations of corticosteroid responsive dermatoses.
https://go.drugbank.com/drugs/DB00547,Desoximetasone,https://go.drugbank.com/structures/DB00547/image.svg,A glucocorticoid used to treat inflammatory and pruritic corticosteroid-responsive dermatoses.
https://go.drugbank.com/drugs/DB06780,Desoxycorticosterone acetate,https://go.drugbank.com/structures/DB06780/image.svg,Not Annotated
https://go.drugbank.com/drugs/DB06700,Desvenlafaxine,https://go.drugbank.com/structures/DB06700/image.svg,An antidepressant agent and SNRI used for the treatment of major depressive disorders in adults.
https://go.drugbank.com/drugs/DB16650,Deucravacitinib,https://go.drugbank.com/structures/DB16650/image.svg,A TYK2 inhibitor being investigated as a treatment for psoriasis.
https://go.drugbank.com/drugs/DB12161,Deutetrabenazine,https://go.drugbank.com/structures/DB12161/image.svg,A vesicular monoamine transporter 2 inhibitor used for the symptomatic treatment of tardive dyskinesia and chorea associated with Huntington's disease.
https://go.drugbank.com/drugs/DB01234,Dexamethasone,https://go.drugbank.com/structures/DB01234/image.svg,"A glucocorticoid available in various modes of administration that is used for the treatment of various inflammatory conditions, including bronchial asthma, as well as endocrine and rheumatic disorders."
https://go.drugbank.com/drugs/DB14649,Dexamethasone acetate,https://go.drugbank.com/structures/DB14649/image.svg,"Commonly known as decadron, dexamethasone acetate is a glucocorticosteroid previously marketed in the USA for the treatment of inflammatory respiratory, allergic, autoimmune, and other conditions.[T797,L10695,L14348] Developed in 1957, dexamethasone is..."
https://go.drugbank.com/drugs/DB14703,Dexamethasone metasulfobenzoate,https://go.drugbank.com/structures/DB14703/image.svg,"An ophthalmic and auricular corticosteroid used with antibiotics for the treatment of otitis externa, blepharitis, and other inflammatory eye conditions."
https://go.drugbank.com/drugs/DB00405,Dexbrompheniramine,https://go.drugbank.com/structures/DB00405/image.svg,An antihistamine used to treat allergy symptoms including upper respiratory tract symptoms.
https://go.drugbank.com/drugs/DB09555,Dexchlorpheniramine maleate,https://go.drugbank.com/structures/DB09555/image.svg,"A first generation antihistamine used to treat allergic and vasomotor rhinitis, allergic conjunctivitis, and mild urticaria and angioedema."
https://go.drugbank.com/drugs/DB01191,Dexfenfluramine,https://go.drugbank.com/structures/DB01191/image.svg,For the management of obesity including weight loss and maintenance of weight loss in patients on a reduced calorie diet
https://go.drugbank.com/drugs/DB09213,Dexibuprofen,https://go.drugbank.com/structures/DB09213/image.svg,A pharmacologically active enantiomer of racemic ibuprofen (NSAID) used to treat pain and inflammation.
https://go.drugbank.com/drugs/DB09214,Dexketoprofen,https://go.drugbank.com/structures/DB09214/image.svg,An NSAID that is the R(-)-enantiomer of racemic ketoprofen with analgesic and anti-inflammatory properties used for the treatment of mild to moderate pain.
https://go.drugbank.com/drugs/DB05351,Dexlansoprazole,https://go.drugbank.com/structures/DB05351/image.svg,"A proton pump inhibitor used to treat erosive esophagitis, heartburn, and gastroesophageal reflux disease (GERD)."
https://go.drugbank.com/drugs/DB00633,Dexmedetomidine,https://go.drugbank.com/structures/DB00633/image.svg,An alpha-2 agonist used for sedation during various procedures.
https://go.drugbank.com/drugs/DB06701,Dexmethylphenidate,https://go.drugbank.com/structures/DB06701/image.svg,A norepinephrine-dopamine reuptake inhibitor used in the treatment of ADHD in conjunction with other therapies.
https://go.drugbank.com/drugs/DB09357,Dexpanthenol,https://go.drugbank.com/structures/DB09357/image.svg,An alcoholic analogue of D-pantothenic acid that is used as a supplement or application to support a healthy epithelium and is also used to prevent vitamin deficiency in patients receiving total parenteral nutrition (TPN).
https://go.drugbank.com/drugs/DB00380,Dexrazoxane,https://go.drugbank.com/structures/DB00380/image.svg,A cytoprotective drug used to prevent and improve cardiomyopathy associated with doxorubicin treatment for metastatic breast cancer.
https://go.drugbank.com/drugs/DB09255,Dextran,https://go.drugbank.com/structures/DB09255/image.svg,"A low molecular weight dextran used as an adjunctive treatment of shock or impending shock due to hemorrhage, burns, surgery or other trauma, as well as the prophylaxis of venous thrombosis and pulmonary embolism during high-risk medical procedures."
https://go.drugbank.com/drugs/DB01576,Dextroamphetamine,https://go.drugbank.com/structures/DB01576/image.svg,A sympathomimetic agent used in the treatment of attention deficit hyperactivity disorder (ADHD) and narcolepsy.
https://go.drugbank.com/drugs/DB00514,Dextromethorphan,https://go.drugbank.com/structures/DB00514/image.svg,An NMDA receptor antagonist used to treat cases of dry cough.
https://go.drugbank.com/drugs/DB00647,Dextropropoxyphene,https://go.drugbank.com/structures/DB00647/image.svg,An opioid analgesic used to treat mild to moderate pain.
https://go.drugbank.com/drugs/DB09341,"Dextrose, unspecified form",https://go.drugbank.com/structures/DB09341/image.svg,A form of glucose used for caloric supply and the replenishment of fluid in total parenteral nutrition and other therapies as well as for the treatment of hypoglycemic episodes.
https://go.drugbank.com/drugs/DB00509,Dextrothyroxine,https://go.drugbank.com/structures/DB00509/image.svg,A thyroid hormone used to treat hyperlipidemia.
https://go.drugbank.com/drugs/DB01209,Dezocine,https://go.drugbank.com/structures/DB01209/image.svg,Indicated in the treatment of moderate to severe pain.
https://go.drugbank.com/drugs/DB11994,Diacerein,https://go.drugbank.com/structures/DB11994/image.svg,An slow-onset anthraquinone IL-1 inhibitor used in the treatment of degenerative joint diseases like osteoarthritis.
https://go.drugbank.com/drugs/DB11260,Diacetyl benzoyl lathyrol,https://go.drugbank.com/structures/DB11260/image.svg,Diacetyl benzoyl lathyrol is an active ingredient in whitening creams. It is also reported to be a skin conditioning agent.
https://go.drugbank.com/drugs/DB12362,Diaminopropanol tetraacetic acid,https://go.drugbank.com/structures/DB12362/image.svg,"Diaminohydroxypropanetetraacetic acid has been investigated for the treatment of Vascular Disease, Coronary Disease, Myocardial Ischemia, Coronary Restenosis, and Coronary Artery Disease, among others."
https://go.drugbank.com/drugs/DB01452,Diamorphine,https://go.drugbank.com/structures/DB01452/image.svg,"An opioid analgesic agent used in the relief of severe pain associated with surgical procedures, myocardial infarction or pain in the terminally ill and for the relief of dyspnea in acute pulmonary edema."
https://go.drugbank.com/drugs/DB00271,Diatrizoate,https://go.drugbank.com/structures/DB00271/image.svg,An injected contrast agent used in radiology.
https://go.drugbank.com/drugs/DB00829,Diazepam,https://go.drugbank.com/structures/DB00829/image.svg,"A long-acting benzodiazepine with rapid onset commonly used to treat panic disorders, severe anxiety, alcohol withdrawal, and seizures."
https://go.drugbank.com/drugs/DB14173,Diazolidinylurea,https://go.drugbank.com/structures/DB14173/image.svg,An ingredient used in hospitals for disinfection.
https://go.drugbank.com/drugs/DB01119,Diazoxide,https://go.drugbank.com/structures/DB01119/image.svg,A non diuretic benzothiadiazine indicated for the management of hypoglycemia in patients who produce an excess of insulin caused by a variety of conditions.
https://go.drugbank.com/drugs/DB13270,Dibekacin,https://go.drugbank.com/structures/DB13270/image.svg,Dibekacin is an aminoglycoside antibiotic marketed in Japan .
https://go.drugbank.com/drugs/DB13225,Dibenzepin,https://go.drugbank.com/structures/DB13225/image.svg,Dibenzepin is approved for use in Europe.
https://go.drugbank.com/drugs/DB01495,Dichloralphenazone,https://go.drugbank.com/structures/DB01495/image.svg,Dichloralphenazone is a sedative composed of chloral hydrate and phenazone. It is typically found in combination products Nodolor and Midrin containing isometheptene and acetaminophen used for the relief of tension...
https://go.drugbank.com/drugs/DB08809,Dichloroacetic acid,https://go.drugbank.com/structures/DB08809/image.svg,"Dichloroacetic acid, often abbreviated DCA, is an acid analogue of acetic acid in which two of the three hydrogen atoms of the methyl group have been replaced by chlorine atoms...."
https://go.drugbank.com/drugs/DB14046,Dichlorobenzene,https://go.drugbank.com/structures/DB14046/image.svg,"Dichlorobenzene refers to any of, or a mixture of, three isomers consisting of benzene in which two of the hydrogen atoms are replaced by chlorine atoms: ortho-, meta-, and paradichlorobenzene...."
https://go.drugbank.com/drugs/DB13269,Dichlorobenzyl alcohol,https://go.drugbank.com/structures/DB13269/image.svg,A medication used to treat a sore throat.
https://go.drugbank.com/drugs/DB14182,Dichromate,https://go.drugbank.com/structures/DB14182/image.svg,Not Annotated
https://go.drugbank.com/drugs/DB00586,Diclofenac,https://go.drugbank.com/structures/DB00586/image.svg,An NSAID used to treat the signs and symptoms of osteoarthritis and rheumatoid arthritis.
https://go.drugbank.com/drugs/DB01144,Diclofenamide,https://go.drugbank.com/structures/DB01144/image.svg,"A carbonic anhydrase inhibitor used for the management of open-angle and secondary glaucoma, as well as acute angle-closure glaucoma in delayed pre-operative setting requiring a reduction in intraocular pressure."
https://go.drugbank.com/drugs/DB00485,Dicloxacillin,https://go.drugbank.com/structures/DB00485/image.svg,A penicillin used to treat penicillinase-producing bacterial infections that are susceptible to the drug.
https://go.drugbank.com/drugs/DB00266,Dicoumarol,https://go.drugbank.com/structures/DB00266/image.svg,For decreasing blood clotting. Often used along with heparin for treatment of deep vein thrombosis.
https://go.drugbank.com/drugs/DB00804,Dicyclomine,https://go.drugbank.com/structures/DB00804/image.svg,An antimuscarinic agent used to treat IBS.
https://go.drugbank.com/drugs/DB00900,Didanosine,https://go.drugbank.com/structures/DB00900/image.svg,A reverse transcriptase inhibitor used to treat HIV.
https://go.drugbank.com/drugs/DB04221,Didecyldimethylammonium,https://go.drugbank.com/structures/DB04221/image.svg,A disinfectant and microbicidal agent used in a variety of products.
https://go.drugbank.com/drugs/DB00890,Dienestrol,https://go.drugbank.com/structures/DB00890/image.svg,A non steroidal estrogen used to treat atrophic vaginitis and kraurosis vulvae.
https://go.drugbank.com/drugs/DB09123,Dienogest,https://go.drugbank.com/structures/DB09123/image.svg,An oral progestin used for the treatment of endometriosis as monotherapy or contraception in combination with ethinylestradiol.
https://go.drugbank.com/drugs/DB11269,Diethylamino hydroxybenzoyl hexyl benzoate,https://go.drugbank.com/structures/DB11269/image.svg,Indicated for use as a sunscreen agent.
https://go.drugbank.com/drugs/DB00711,Diethylcarbamazine,https://go.drugbank.com/structures/DB00711/image.svg,An anthelmintic used to treat filarial infections like Wuchereria bancrofti and Loa loa.
https://go.drugbank.com/drugs/DB00937,Diethylpropion,https://go.drugbank.com/structures/DB00937/image.svg,An appetite suppressant used for the short term treatment of exogenous obesity in addition to calorie restriction.
https://go.drugbank.com/drugs/DB00255,Diethylstilbestrol,https://go.drugbank.com/structures/DB00255/image.svg,Used in the treatment of prostate cancer. Previously used in the prevention of miscarriage or premature delivery in pregnant women prone to miscarriage or premature delivery.
https://go.drugbank.com/drugs/DB11282,Diethyltoluamide,https://go.drugbank.com/structures/DB11282/image.svg,"An insect repellant, also known as DEET."
https://go.drugbank.com/drugs/DB11938,Difelikefalin,https://go.drugbank.com/structures/DB11938/image.svg,A kappa opioid receptor agonist used in the treatment of pruritus associated with chronic kidney disease in patients undergoing hemodialysis.
https://go.drugbank.com/drugs/DB01501,Difenoxin,https://go.drugbank.com/structures/DB01501/image.svg,An antidiarrheal agent used as an adjunct for the management of acute nonspecific diarrhea and acute exacerbations of chronic functional diarrhea.
https://go.drugbank.com/drugs/DB00223,Diflorasone,https://go.drugbank.com/structures/DB00223/image.svg,"A topical corticosteroid used to treat the symptoms of various inflammatory skin conditions that cause erythema, pruritus, and discomfort."
https://go.drugbank.com/drugs/DB00861,Diflunisal,https://go.drugbank.com/structures/DB00861/image.svg,"An NSAID used to treat mild to moderate pain, inflammation, osteoarthritis, and rheumatoid arthritis."
https://go.drugbank.com/drugs/DB09095,Difluocortolone,https://go.drugbank.com/structures/DB09095/image.svg,"A topical corticosteroid used for the symptomatic treatment of inflammatory skin disorders like eczema, seborrheic eczema, lichen planus and psoriasis."
https://go.drugbank.com/drugs/DB06781,Difluprednate,https://go.drugbank.com/structures/DB06781/image.svg,A topical corticosteroid used for the symptomatic treatment of inflammation and pain associated with ocular surgery.
https://go.drugbank.com/drugs/DB01396,Digitoxin,https://go.drugbank.com/structures/DB01396/image.svg,"A cardiac glycoside used in the treatment and management of congestive cardiac insufficiency, arrhythmias and heart failure."
https://go.drugbank.com/drugs/DB00390,Digoxin,https://go.drugbank.com/structures/DB00390/image.svg,A cardiac glycoside used in the treatment of mild to moderate heart failure and for ventricular response rate control in chronic atrial fibrillation.
https://go.drugbank.com/drugs/DB12945,Dihydralazine,https://go.drugbank.com/structures/DB12945/image.svg,Dihydralazine is under investigation in clinical trial NCT00311974 (The Effect of Dihydralazine on Kidney Function and Hormones in Healthy Individuals).
https://go.drugbank.com/drugs/DB11274,Dihydro-alpha-ergocryptine,https://go.drugbank.com/structures/DB11274/image.svg,A nootropic with an unknown mechanism of action indicated in individuals over sixty who manifest signs and symptoms of an idiopathic decline in mental capacity.
https://go.drugbank.com/drugs/DB01551,Dihydrocodeine,https://go.drugbank.com/structures/DB01551/image.svg,An opioid analgesic agent used for the management of pain severe enough to require an opioid analgesic and for which alternative treatments are inadequate.
https://go.drugbank.com/drugs/DB11273,Dihydroergocornine,https://go.drugbank.com/structures/DB11273/image.svg,A nootropic with an unknown mechanism of action indicated in individuals over sixty who manifest signs and symptoms of an idiopathic decline in mental capacity.
https://go.drugbank.com/drugs/DB13345,Dihydroergocristine,https://go.drugbank.com/structures/DB13345/image.svg,An ergot alkaloid used to delay progressive mental decline in conditions like Alzheimer's.
https://go.drugbank.com/drugs/DB00320,Dihydroergotamine,https://go.drugbank.com/structures/DB00320/image.svg,An ergot alkaloid used in the acute treatment of migraine headache and cluster headache.
https://go.drugbank.com/drugs/DB11512,Dihydrostreptomycin,https://go.drugbank.com/structures/DB11512/image.svg,"Dihydrostreptomycin is an aminoglycoside antibiotic. In humans, the use of dihydrostreptomycin has been associated with ototoxicity. The FDA withdrew its approval for the use of all drug products containing dihydrostreptomycin..."
https://go.drugbank.com/drugs/DB01070,Dihydrotachysterol,https://go.drugbank.com/structures/DB01070/image.svg,A synthetic analog of vitamin D that does not require renal activation like vitamin D2 or Vitamin D3.
https://go.drugbank.com/drugs/DB09115,Diiodohydroxyquinoline,https://go.drugbank.com/structures/DB09115/image.svg,Used in the treatment of amoebiasis.
https://go.drugbank.com/drugs/DB14638,Diloxanide furoate,https://go.drugbank.com/structures/DB14638/image.svg,"Diloxanide is used alone as a primary agent in the treatment of asymptomatic (cyst passers) intestinal amebiasis caused by Entamoeba histolytica. Diloxanide may also be used concurrently, or sequentially, with..."
https://go.drugbank.com/drugs/DB00343,Diltiazem,https://go.drugbank.com/structures/DB00343/image.svg,A calcium channel blocker used to treat hypertension and to manage chronic stable angina.
https://go.drugbank.com/drugs/DB13858,Dimazole,https://go.drugbank.com/structures/DB13858/image.svg,Dimazole (diamthazole) is an antifungal. It was withdrawn in Franch in 1972 due to neuropsychiatric reactions.
https://go.drugbank.com/drugs/DB00985,Dimenhydrinate,https://go.drugbank.com/structures/DB00985/image.svg,"A medication used to prevent and treat nausea, vomiting, vertigo, and motion sickness."
https://go.drugbank.com/drugs/DB06782,Dimercaprol,https://go.drugbank.com/structures/DB06782/image.svg,"A chelating agent used as an antidote to arsenic, gold, and mercury poisoning, as well as acute lead poisoning in combination with edetate calcium disodium."
https://go.drugbank.com/drugs/DB14089,Dimercaptosuccinic acid,https://go.drugbank.com/structures/DB14089/image.svg,Not Annotated
https://go.drugbank.com/drugs/DB11074,Dimethicone,https://go.drugbank.com/structures/DB11074/image.svg,An ingredient used to treat dry and irritated eyes.
https://go.drugbank.com/drugs/DB14005,Dimethicone 410,https://go.drugbank.com/structures/DB14005/image.svg,"Dimethicone is approved as a transdermal drug delivery system. Dimethicone 410 is part of the simethicone element in Dow Corning Q7-2242 LVA which is an antifoam.[L2163, L2166] Some OTC's containing..."
https://go.drugbank.com/drugs/DB08908,Dimethyl fumarate,https://go.drugbank.com/structures/DB08908/image.svg,A medication used to treat patients with the relapsing-remitting form of multiple sclerosis.
https://go.drugbank.com/drugs/DB01093,Dimethyl sulfoxide,https://go.drugbank.com/structures/DB01093/image.svg,"A reversible mitogen-activated extracellular signal-regulated kinase-1 (MEK1) and MEK2 inhibitor used to treat certain types of melanoma, metastatic non-small cell lung cancer, and locally advanced or metastatic anaplastic thyroid cancer."
https://go.drugbank.com/drugs/DB08801,Dimetindene,https://go.drugbank.com/structures/DB08801/image.svg,A 1st generation selective H1 antagonist used topically as an antipruritic and orally to treat allergies.
https://go.drugbank.com/drugs/DB08967,Dimetotiazine,https://go.drugbank.com/structures/DB08967/image.svg,Dimetotiazine has considerable antiemetic &amp; serotonin antagonistic action used mainly in allergic skin conditions.
https://go.drugbank.com/drugs/DB12789,Dinoprost,https://go.drugbank.com/structures/DB12789/image.svg,A medication used to induce a second trimester abortion.
https://go.drugbank.com/drugs/DB01160,Dinoprost tromethamine,https://go.drugbank.com/structures/DB01160/image.svg,Used for aborting second-trimester pregnancy (between the twelfth to eighteenth week of gestation) and in incomplete abortion or for therapeutic abortion in cases of intrauterine fetal death and congenital abnormalities...
https://go.drugbank.com/drugs/DB00917,Dinoprostone,https://go.drugbank.com/structures/DB00917/image.svg,A prostaglandin used to induce labor or abortion as well as to treat nonmetastatic gestational trophoblastic disease.
https://go.drugbank.com/drugs/DB13970,Dioctyldimonium,https://go.drugbank.com/structures/DB13970/image.svg,Not Annotated
https://go.drugbank.com/drugs/DB08995,Diosmin,https://go.drugbank.com/structures/DB08995/image.svg,A citrus flavonoid medication used to support vascular health.
https://go.drugbank.com/drugs/DB11221,Dioxybenzone,https://go.drugbank.com/structures/DB11221/image.svg,A benzophenone derivative used in sunscreens to block UVB and short-wave UVA radiation.
https://go.drugbank.com/drugs/DB14174,Dipentamethylenethiuram disulfide,https://go.drugbank.com/structures/DB14174/image.svg,Not Annotated
https://go.drugbank.com/drugs/DB13720,Diphemanil,https://go.drugbank.com/structures/DB13720/image.svg,"Used in the treatment of peptic ulcer, gastric hyperacidity, and hypermotility in gastritis and pylorospasm, and in the treatment of hyperhidrosis (excessive perspiration)."
https://go.drugbank.com/drugs/DB01075,Diphenhydramine,https://go.drugbank.com/structures/DB01075/image.svg,"A H1 receptor antihistamine used in the treatment of seasonal allergies, and various allergic reactions including sneezing, runny nose, itchy/watery eyes, itching of nose or throat, pruritus, urticaria, insect bites/stings, and allergic rashes."
https://go.drugbank.com/drugs/DB01231,Diphenidol,https://go.drugbank.com/structures/DB01231/image.svg,An antiemetic agent used for the prevention and symptomatic treatment of nausea and vomiting associated with various conditions as Meniere's disease and surgery of the middle and inner ear.
https://go.drugbank.com/drugs/DB01081,Diphenoxylate,https://go.drugbank.com/structures/DB01081/image.svg,An antidiarrheal medication used with atropine to manage diarrhea.
https://go.drugbank.com/drugs/DB14191,Diphenylguanidine,https://go.drugbank.com/structures/DB14191/image.svg,Diphenylguanidine is approved for use within allergenic epicutaneous patch tests which are indicated for use as an aid in the diagnosis of allergic contact dermatitis (ACD) in persons 6 years...
https://go.drugbank.com/drugs/DB01146,Diphenylpyraline,https://go.drugbank.com/structures/DB01146/image.svg,"An antihistamine used for the treatment of allergic rhinitis, hay fever, and allergic skin disorders."
https://go.drugbank.com/drugs/DB00449,Dipivefrin,https://go.drugbank.com/structures/DB00449/image.svg,A prodrug of epinephrine used in ophthalmic solutions to reduce intraocular pressure in chronic open-angle glaucoma.
https://go.drugbank.com/drugs/DB09414,Dipotassium phosphate,https://go.drugbank.com/structures/DB09414/image.svg,An ionic compound used for electrolyte replenishment and total parenteral nutrition (TPN) therapy.
https://go.drugbank.com/drugs/DB00975,Dipyridamole,https://go.drugbank.com/structures/DB00975/image.svg,A phosphodiesterase inhibitor used to prevent postoperative thromboembolic events.
https://go.drugbank.com/drugs/DB11327,Dipyrithione,https://go.drugbank.com/structures/DB11327/image.svg,Scalp dandruff
